{
  "schema_version": "1.0",
  "timestamp": "2025-01-15T12:00:00+00:00",
  "hostname": "build-host-01",
  "os": "Linux 6.8.0-45-generic",
  "arch": "x86_64",
  "kernel": "6.8.0-45-generic",
  "rust_toolchain": {
    "version": "nightly",
    "edition": "2024",
    "channel": "nightly"
  },
  "python_version": "3.12.0",
  "env_vars": {
    "CARGO_HOME": "/home/builder/.cargo",
    "RUSTUP_HOME": "/home/builder/.rustup"
  }
}
